{
  "id": "demo-family-tax-relief-2027",
  "slug": "demo-rebaja-estatal-familiar-2027",
  "publicName": "DEMO — reducción sintética del tramo estatal",
  "shortDescription": "Escenario de desarrollo que reduce en un punto porcentual todos los tipos de la escala general estatal. No es una propuesta oficial ni de un partido político.",
  "origin": "DEMO — escenario sintético de Cifra Cívica",
  "taxYear": 2027,
  "status": "simulated",
  "validationStatus": "household_tested",
  "territorialScope": ["01", "02", "03", "04", "05", "06", "07", "08", "09", "10", "11", "12", "13", "14", "17"],
  "fiscalRegimeScope": ["common"],
  "effectiveFrom": "2027-01-01",
  "effectiveTo": "2027-12-31",
  "supersedes": [],
  "inheritedBaseline": "baseline-2027-common-reference",
  "legalOrProposalSources": ["source-synthetic-demo-methodology"],
  "interpretationNotes": ["El cambio es una prueba mecánica de -100 puntos básicos en cada tipo estatal general; el tipo nunca baja de cero."],
  "assumptions": ["No cambia la escala autonómica, el ahorro, las cotizaciones, los mínimos ni las deducciones."],
  "parameterSet": "es-common-reference-2026-v1",
  "parameterOverrides": {"irpf": {"stateGeneralRateDeltaBasisPoints": -100}},
  "formulaOverrides": {},
  "knownLimitations": ["DEMO — no es una propuesta oficial ni pretende representar una reforma presupuestariamente viable."],
  "testCaseIds": ["scenario-state-rate-delta", "scenario-inheritance"],
  "aggregateBenchmarkIds": [],
  "reviewedBy": ["equipo técnico de Cifra Cívica"],
  "lastReviewedAt": "2026-07-13",
  "modelCompatibility": ">=0.1.0",
  "policyVersion": "2027.demo-family-tax-relief.1",
  "publicChangelog": [{"date": "2026-07-13", "description": "Fixture sintético inicial para pruebas comparativas."}],
  "methodologyPath": "methodology/demo-rebaja-estatal-familiar-2027.md",
  "published": true,
  "isSynthetic": true,
  "carryForwardFromTaxYear": 2026,
  "uncertaintyStatus": "high"
}

