{
  "id": "demo-child-transfer-2027",
  "slug": "demo-transferencia-infancia-2027",
  "publicName": "DEMO — transferencia sintética por descendiente",
  "shortDescription": "Escenario de desarrollo que añade 1.200 euros anuales por cada descendiente fiscal elegible. No es una prestación existente ni una propuesta oficial.",
  "origin": "DEMO — escenario sintético de Cifra Cívica",
  "taxYear": 2027,
  "status": "simulated",
  "validationStatus": "household_tested",
  "territorialScope": ["01", "02", "03", "04", "05", "06", "07", "08", "09", "10", "11", "12", "13", "14", "17"],
  "fiscalRegimeScope": ["common"],
  "effectiveFrom": "2027-01-01",
  "effectiveTo": "2027-12-31",
  "supersedes": [],
  "inheritedBaseline": "baseline-2027-common-reference",
  "legalOrProposalSources": ["source-synthetic-demo-methodology"],
  "interpretationNotes": ["Se añaden 120.000 céntimos por descendiente con dependentForTaxPurposes=true; no se modela retirada por renta."],
  "assumptions": ["La transferencia sintética se considera exenta para el ejercicio técnico y se suma íntegramente a la renta disponible."],
  "parameterSet": "es-common-reference-2026-v1",
  "parameterOverrides": {"benefits": {"annualPerEligibleDescendantCents": 120000}},
  "formulaOverrides": {},
  "knownLimitations": ["DEMO — no es una prestación vigente ni una propuesta oficial y no contiene diseño presupuestario o de elegibilidad real."],
  "testCaseIds": ["scenario-child-transfer", "scenario-inheritance"],
  "aggregateBenchmarkIds": [],
  "reviewedBy": ["equipo técnico de Cifra Cívica"],
  "lastReviewedAt": "2026-07-13",
  "modelCompatibility": ">=0.1.0",
  "policyVersion": "2027.demo-child-transfer.1",
  "publicChangelog": [{"date": "2026-07-13", "description": "Fixture sintético inicial para pruebas comparativas."}],
  "methodologyPath": "methodology/demo-transferencia-infancia-2027.md",
  "published": true,
  "isSynthetic": true,
  "carryForwardFromTaxYear": 2026,
  "uncertaintyStatus": "high"
}

